<?xml version="1.0" encoding="UTF-8"?>

<database version="1.1" id="networking" language="ca"
	xmlns:xsi="http://www.w3.org/2001/XMLSchema-instance"
	xsi:noNamespaceSchemaLocation="file:///usr/share/games/freevial/databases/freevial-database.xsd">

  <information>
    <name>Nom Categoria</name>
    <description>Descripci√≥ categoria</description>
    <destination>Per a qui</destination>
    <timestamp_creation>1189202400</timestamp_creation>
    <timestamp_modification>1200139483</timestamp_modification>

	<license>GPLv3</license>
	<url>http://www.freevial.org/bases/nomcategoria.xml</url>
	<contact>info@freevial.org</contact>

    <authors>
      <author>Autor 1</author>
      <author>Autor ...</author>
    </authors>
  </information>

  <appearance>
    <image>imatge.png</image>
    <sound>so.ogg</sound>
  </appearance>

  <questions>
    <question>
      <sentence>Text de la pregunta?</sentence>
      <author>Autor </author>
      <comments>Notes al final</comments>
      <answers>
        <answer correct="true">Resposta correcta</answer>
        <answer>Resposta incorrecta</answer>
        <answer>Immediate Release Communications</answer>
      </answers>
    </question>
    <question>

  </questions>
</database>
